{
  "provider_name": "FinClear GmbH",
  "deployer_name": "Deutsche Partner Bank AG",
  "system_name": "CreditGuard",
  "version": "2.1",
  "intended_purpose": "Assess creditworthiness of retail loan applicants using 20 financial and personal attributes to support human credit officers at Deutsche Partner Bank AG. Decisions are advisory; final approval rests with a licensed credit officer.",
  "declared_modality": "tabular",
  "declared_risk_tier": "high",
  "declared_annex_iii_sections": [
    "5"
  ],
  "deployment_context": "b2b",
  "provider_elects_third_party": false,
  "gdpr_overlap": true,
  "gpai_general_purpose": false,
  "special_category_data": false,
  "art43_preview": null,
  "cgsa_assessment_id": "finclear-creditguard-001",
  "entity_type": [
    "provider"
  ],
  "art25_status_change": [
    "none"
  ],
  "annex_i_section_a": [],
  "annex_i_section_b": [],
  "third_party_ca_legally_required": false,
  "art6_derogation_claimed": false,
  "art6_derogation_rationale": null,
  "territorial_scope": [
    "placed_on_eu_market",
    "established_in_eu"
  ],
  "gpai_systemic_risk": false,
  "art2_exclusion": "none",
  "art5_prohibited_practices": [],
  "art50_transparency_triggers": [],
  "is_public_body_or_public_service": false
}