{
  "provider_name": "TalentSift GmbH",
  "deployer_name": "Nordwind Personal Services AG",
  "system_name": "TalentRank",
  "version": "1.2",
  "intended_purpose": "Screen free-text CVs/resumes of job applicants and produce a shortlist recommendation for human recruiters at staffing agencies. The system classifies each anonymised CV text as shortlist / no-shortlist for a given vacancy family; output is advisory and every shortlist decision is reviewed by a qualified recruiter before any candidate communication.",
  "declared_modality": "nlp",
  "declared_risk_tier": "high",
  "declared_annex_iii_sections": [
    "4"
  ],
  "deployment_context": "b2b",
  "provider_elects_third_party": false,
  "gdpr_overlap": true,
  "gpai_general_purpose": false,
  "special_category_data": false,
  "art43_preview": null,
  "cgsa_assessment_id": "talentsift-talentrank-001",
  "entity_type": [
    "provider"
  ],
  "art25_status_change": [
    "none"
  ],
  "annex_i_section_a": [],
  "annex_i_section_b": [],
  "third_party_ca_legally_required": false,
  "art6_derogation_claimed": false,
  "art6_derogation_rationale": null,
  "territorial_scope": [
    "placed_on_eu_market",
    "established_in_eu"
  ],
  "gpai_systemic_risk": false,
  "art2_exclusion": "none",
  "art5_prohibited_practices": [],
  "art50_transparency_triggers": [],
  "is_public_body_or_public_service": false
}
