{
  "provider_name": "RetailIQ AG",
  "deployer_name": "Coop Schweiz AG",
  "system_name": "DemandPulse",
  "version": "3.0",
  "intended_purpose": "Weekly demand forecasting for grocery and FMCG product categories at EU retail chains. Outputs 4-week ahead sales forecasts used for procurement planning. No individual-level data processed -- aggregate SKU/store level only.",
  "declared_modality": "time_series",
  "declared_risk_tier": "limited",
  "declared_annex_iii_sections": [],
  "deployment_context": "b2b",
  "provider_elects_third_party": false,
  "gdpr_overlap": false,
  "gpai_general_purpose": false,
  "special_category_data": false,
  "art43_preview": null,
  "cgsa_assessment_id": "retailiq-demandpulse-001",
  "entity_type": [
    "provider"
  ],
  "art25_status_change": [
    "none"
  ],
  "annex_i_section_a": [],
  "annex_i_section_b": [],
  "third_party_ca_legally_required": false,
  "art6_derogation_claimed": false,
  "art6_derogation_rationale": null,
  "territorial_scope": [
    "placed_on_eu_market",
    "established_in_eu"
  ],
  "gpai_systemic_risk": false,
  "art2_exclusion": "none",
  "art5_prohibited_practices": [],
  "art50_transparency_triggers": [
    "none"
  ],
  "is_public_body_or_public_service": false
}